{
  "$id": "https://schemas.uspace.ge/cis/change/v1.json",
  "$schema": "https://json-schema.org/draft/2020-12/schema",
  "additionalProperties": false,
  "description": "cis/change/v1: one change record, the body of the change feed,\nof the webhook payload (inside the JWS claims) and of the\nstream's change frames (docs/PLAN.md section 6.7, section 15\nQ28, Q38). msg_id is the change cursor in decimal; pull_url asks\nfor the delta from the previous version on CISP_PUBLIC_BASE_URL;\nbbox is [min lng, min lat, max lng, max lat] of what changed,\nabsent for the whole dataset. producer is uspace-cisp on the bus,\nthe change feed and the stream, and cisp/deliver-<instance> in a\nwebhook (the deliver instance that sent it).\n\nreason is an open enumeration (spec 04 section 4: values are\nadded within v1). A receiver pulls pull_url only for publication\nand the restriction_* reasons, and only when pull_url's host is\nthe CISP's; it acknowledges subscription_test (the verification\nping of a new or changed subscription), republished (the current\nversion announced again, content unchanged) and any reason it\ndoes not know with 204, without pulling. A subscription_test\nrecord names no change: msg_id is the delivery id (a ULID),\ndataset the first of the subscription's datasets, version and\netag its current version (0 before the first), feature_ids and\nremoved_ids empty, at when the ping was queued.\n",
  "properties": {
    "at": {
      "format": "date-time",
      "type": "string"
    },
    "bbox": {
      "items": {
        "format": "double",
        "type": "number"
      },
      "maxItems": 4,
      "minItems": 4,
      "type": "array"
    },
    "dataset": {
      "enum": [
        "zones",
        "uspace_airspace",
        "ussp_list",
        "restrictions"
      ],
      "type": "string"
    },
    "etag": {
      "examples": [
        "\"zones:5\""
      ],
      "type": "string"
    },
    "feature_ids": {
      "description": "Every identifier added, changed or removed, sorted.",
      "items": {
        "type": "string"
      },
      "type": "array"
    },
    "msg_id": {
      "description": "The change cursor in decimal; the delivery id (a ULID) for subscription_test.",
      "pattern": "^([0-9]+|[0-9A-HJKMNP-TV-Z]{26})$",
      "type": "string"
    },
    "producer": {
      "pattern": "^(uspace-cisp|cisp/deliver-[A-Za-z0-9._-]{1,64})$",
      "type": "string"
    },
    "pull_url": {
      "format": "uri",
      "type": "string"
    },
    "reason": {
      "enum": [
        "publication",
        "restriction_created",
        "restriction_activated",
        "restriction_extended",
        "restriction_ended",
        "restriction_cancelled",
        "restriction_expired",
        "republished",
        "subscription_test"
      ],
      "type": "string"
    },
    "removed_ids": {
      "items": {
        "type": "string"
      },
      "type": "array"
    },
    "schema": {
      "const": "cis/change/v1",
      "type": "string"
    },
    "version": {
      "description": "The version the change made (at least 1); a subscription_test names the current version, 0 before the first.",
      "format": "int64",
      "minimum": 0,
      "type": "integer"
    }
  },
  "required": [
    "schema",
    "msg_id",
    "producer",
    "dataset",
    "version",
    "etag",
    "feature_ids",
    "removed_ids",
    "reason",
    "at",
    "pull_url"
  ],
  "title": "cis/change/v1: one change record of the change feed, the webhooks and the stream",
  "type": "object"
}
